{"task":"detach-no-trace-guest-runs","verdict":"pass","head":"38fd3f80e278c02e80cf4fc53377dd0517186dd0","tree":"83653158ed51fb2a53f49755046c12d9de58d33b","brief":{"path":"brief-677-detach-no-trace-guest-runs.md","sha256":"4d5dfcd3a7519c084c569c5a81d34e1394e68a9b5370a4f58cbc59acaeda16f5"},"report":{"path":"review-2.md","sha256":"79d6a106371c40fccde93115d3eb94c7d4a3413ae25192f90a91b59c2fe1e797"}}
